{
  "fixtureRoot": "tests/fixtures",
  "generatedBy": "src.real_data_coverage.build_real_data_coverage_report",
  "publicEvidence": [
    {
      "kind": "public-derived-source",
      "notes": "Curated public RPM metadata excerpt preserving real nginx, nginx-core, and nginx-filesystem package metadata.",
      "path": "tests/fixtures/rpm-primary.xml",
      "refreshedAt": "2026-06-17",
      "source": "AlmaLinux 9 AppStream x86_64 primary.xml.gz excerpt",
      "sourceUrl": "https://repo.almalinux.org/almalinux/9/AppStream/x86_64/os/"
    },
    {
      "derivedFrom": [
        "tests/fixtures/rpm-primary.xml"
      ],
      "kind": "deterministic-public-derived-variant",
      "notes": "Companion snapshot used to exercise repository diff behavior.",
      "path": "tests/fixtures/rpm-primary-updated.xml",
      "refreshedAt": "2026-06-17",
      "source": "AlmaLinux 9 AppStream x86_64 primary.xml.gz excerpt",
      "sourceUrl": "https://repo.almalinux.org/almalinux/9/AppStream/x86_64/os/"
    },
    {
      "derivedFrom": [
        "tests/fixtures/rpm-primary.xml"
      ],
      "kind": "local-pointer-fixture",
      "notes": "Keeps repodata discovery tests offline and deterministic.",
      "path": "tests/fixtures/repodata/repomd.xml",
      "refreshedAt": "2026-06-17",
      "source": "Local repomd.xml pointer for the committed primary excerpt",
      "sourceUrl": "https://repo.almalinux.org/almalinux/9/AppStream/x86_64/os/"
    },
    {
      "kind": "public-derived-source",
      "notes": "Compact excerpt preserving real build ID, artifacts, build tasks, sign tasks, and package names.",
      "path": "tests/fixtures/albs-build.json",
      "refreshedAt": "2026-06-17",
      "source": "Public ALBS build 17812 API excerpt",
      "sourceUrl": "https://build.almalinux.org/api/v1/builds/17812/"
    },
    {
      "derivedFrom": [
        "tests/fixtures/albs-build.json"
      ],
      "kind": "deterministic-public-derived-variant",
      "notes": "Companion snapshot used for build diff and release coverage tests.",
      "path": "tests/fixtures/albs-build-updated.json",
      "refreshedAt": "2026-06-17",
      "source": "Public ALBS build 17812 API excerpt",
      "sourceUrl": "https://build.almalinux.org/api/v1/builds/17812/"
    },
    {
      "derivedFrom": [
        "tests/fixtures/rpm-primary.xml"
      ],
      "generator": "scripts/generate_public_fixture_reports.py",
      "kind": "generated-public-report",
      "path": "tests/fixtures/rpm-repository-summary.json",
      "reportSchema": "edgp.rpm.repository_summary.v1"
    },
    {
      "derivedFrom": [
        "tests/fixtures/rpm-primary.xml",
        "tests/fixtures/rpm-primary-updated.xml"
      ],
      "generator": "scripts/generate_public_fixture_reports.py",
      "kind": "generated-public-report",
      "path": "tests/fixtures/rpm-repository-diff.json",
      "reportSchema": "edgp.rpm.repository_diff.v1"
    },
    {
      "derivedFrom": [
        "tests/fixtures/albs-build.json"
      ],
      "generator": "scripts/generate_public_fixture_reports.py",
      "kind": "generated-public-report",
      "path": "tests/fixtures/albs-artifact-inventory.json",
      "reportSchema": "edgp.albs.artifact_inventory.v1"
    },
    {
      "derivedFrom": [
        "tests/fixtures/albs-build.json"
      ],
      "generator": "scripts/generate_public_fixture_reports.py",
      "kind": "generated-public-report",
      "path": "tests/fixtures/albs-build-timing.json",
      "reportSchema": "edgp.albs.build_timing.v1"
    },
    {
      "derivedFrom": [
        "tests/fixtures/albs-build.json",
        "tests/fixtures/albs-build-updated.json"
      ],
      "generator": "scripts/generate_public_fixture_reports.py",
      "kind": "generated-public-report",
      "path": "tests/fixtures/albs-build-diff.json",
      "reportSchema": "edgp.albs.build_diff.v1"
    },
    {
      "derivedFrom": [
        "tests/fixtures/albs-build-updated.json"
      ],
      "generator": "scripts/generate_public_fixture_reports.py",
      "kind": "generated-public-report",
      "path": "tests/fixtures/albs-log-intelligence.json",
      "reportSchema": "edgp.albs.log_intelligence.v1"
    },
    {
      "derivedFrom": [
        "tests/fixtures/albs-build.json",
        "tests/fixtures/albs-build-updated.json"
      ],
      "generator": "scripts/generate_public_fixture_reports.py",
      "kind": "generated-public-report",
      "path": "tests/fixtures/albs-release-completeness.json",
      "reportSchema": "edgp.albs.release_completeness.v1"
    },
    {
      "derivedFrom": [
        "tests/fixtures/albs-build.json"
      ],
      "generator": "scripts/generate_public_fixture_reports.py",
      "kind": "generated-public-report",
      "notes": "Joins a tiny installed RPM graph to the public ALBS artifact excerpt.",
      "path": "tests/fixtures/rpm-albs-provenance.json",
      "reportSchema": "edgp.rpm.albs_provenance.v1"
    },
    {
      "derivedFrom": [
        "tests/fixtures/libsolv-transaction.txt"
      ],
      "generator": "scripts/generate_public_fixture_reports.py",
      "kind": "generated-public-report",
      "path": "tests/fixtures/libsolv-bridge.json",
      "reportSchema": "edgp.libsolv.bridge.v1"
    },
    {
      "derivedFrom": [
        "tests/fixtures/fixture-provenance.json"
      ],
      "generator": "scripts/generate_public_fixture_reports.py",
      "kind": "generated-public-report",
      "notes": "Summarizes which committed fixtures are public-derived, generated, or intentionally synthetic.",
      "path": "tests/fixtures/real-data-coverage.json",
      "reportSchema": "edgp.real_data.coverage.v1"
    },
    {
      "derivedFrom": [
        "tests/fixtures/real-data-coverage.json"
      ],
      "generator": "scripts/generate_public_fixture_reports.py",
      "kind": "generated-public-report",
      "notes": "Ranks synthetic fixture groups that should move toward public evidence where doing so improves data fidelity.",
      "path": "tests/fixtures/real-data-replacement-plan.json",
      "reportSchema": "edgp.real_data.replacement_plan.v1"
    },
    {
      "derivedFrom": [
        "tests/fixtures/real-data-coverage.json"
      ],
      "generator": "scripts/generate_public_fixture_reports.py",
      "kind": "generated-public-report",
      "notes": "No-regression baseline for comparing public evidence coverage between two fixture snapshots.",
      "path": "tests/fixtures/real-data-coverage-diff.json",
      "reportSchema": "edgp.real_data.coverage_diff.v1"
    }
  ],
  "qualityGates": [
    {
      "command": "python -B scripts/generate_public_fixture_reports.py --check && python -B scripts/generate_fixture_provenance.py --check",
      "name": "public fixture freshness"
    },
    {
      "command": "edgp real-data-coverage --fixture-dir tests/fixtures",
      "name": "real-data coverage JSON"
    },
    {
      "command": "edgp real-data-coverage-bundle --fixture-dir tests/fixtures --output-dir reports/real-data-coverage --triage-summary",
      "name": "real-data coverage bundle"
    }
  ],
  "replacementPlan": [
    {
      "decision": "hybrid",
      "fileCount": 3,
      "group": "npm lockfiles and registry mock",
      "kind": "synthetic-edge-case",
      "nextStep": "Replace the happy-path package-lock with a tiny public npm project lockfile; keep conflict and registry-mock fixtures synthetic because they isolate resolver edge cases.",
      "priority": "medium"
    },
    {
      "decision": "replace-where-practical",
      "fileCount": 2,
      "group": "Python and Rust lockfiles",
      "kind": "synthetic-edge-case",
      "nextStep": "Use small public Poetry and Cargo lockfiles when their dependency shape is useful; keep parser-minimal fixtures for offline format smoke.",
      "priority": "medium"
    },
    {
      "decision": "replace-where-practical",
      "fileCount": 4,
      "group": "Maven dependency trees",
      "kind": "synthetic-edge-case",
      "nextStep": "Add a captured dependency tree from a public Maven project, while keeping classifier, scope, marker, and packaging snippets synthetic.",
      "priority": "medium"
    },
    {
      "decision": "hybrid",
      "fileCount": 8,
      "group": "Generic graph and SBOM examples",
      "kind": "synthetic-edge-case",
      "nextStep": "Add one public CycloneDX SBOM when available; keep tiny graph snapshots synthetic so traversal and diff assertions stay auditable.",
      "priority": "low"
    },
    {
      "decision": "replace-where-practical",
      "fileCount": 9,
      "group": "Advisory and OSV-shaped samples",
      "kind": "synthetic-public-shape",
      "nextStep": "Replace public advisory feed samples with curated OSV/GHSA/RHSA records where licensing and stability allow; keep severity edge cases synthetic.",
      "priority": "high"
    },
    {
      "decision": "keep-generated",
      "fileCount": 10,
      "group": "Report and export bundle fixtures",
      "kind": "synthetic-validation-case",
      "nextStep": "Keep these as generated contract fixtures; they document EDGP output shape rather than upstream data fidelity.",
      "priority": "low"
    },
    {
      "decision": "keep-synthetic",
      "fileCount": 28,
      "group": "Validation failure examples",
      "kind": "synthetic-validation-case",
      "nextStep": "Keep negative fixtures synthetic because they deliberately model invalid states that public sources should not provide.",
      "priority": "low"
    },
    {
      "decision": "keep-generated",
      "fileCount": 5,
      "group": "Performance, CSR, and license reports",
      "kind": "synthetic-report",
      "nextStep": "Refresh from deterministic EDGP generators; public replacement is less useful than stable performance and rendering contracts.",
      "priority": "low"
    }
  ],
  "schema": "edgp.real_data.coverage.v1",
  "sourceSchema": "edgp.fixture.provenance.v1",
  "sourceUrls": [
    {
      "access": "public",